{
  "schemaVersion": "0.6.1",
  "mapId": "citychat-color-usage-atlas",
  "mapVersion": "citychat-color-role-map-v0.6.1",
  "product": "citychat",
  "artifactBuildId": "citychat-ui-20260823-01",
  "mode": "product_usage_overlay",
  "fullLivingReference": false,
  "authority": {
    "ves": {
      "ref": "../../../assets/downloads/citychat-visual-experience-specification-v0.6.md",
      "sha256": "5a137425ab195c4b5dd123ea86d0ee8730b370540eb57f05baf978fc6ca33a21",
      "status": "approved_normative_authoring_authority"
    },
    "lds": {
      "ref": "https://github.com/montri-th/Landometer/tree/d82ac775ab9d35a84cfb0dc77bc0ae804a7a0665",
      "sha256": "5afa9a93bafa8f2e5edb7e929d4924bc548a415098377ad53e18097c56980287",
      "status": "pinned_upstream_machine_authority",
      "commit": "d82ac775ab9d35a84cfb0dc77bc0ae804a7a0665",
      "colorSetId": "color-srgb-05",
      "machinePackage": "v0.9.0-mp1"
    },
    "identity": {
      "ref": "../../../assets/identity/identity-assets.v0.6.1.json",
      "sha256": "56a5cc6f4fbecdcb150deea5fc91f81a795cab32d8b746eeb639fd3b8bce6bef",
      "status": "approved_exact_build_role_manifest"
    },
    "sharedAtlas": {
      "immutableUrl": "https://montri-th.github.io/Landometer/landometer-design-system-v0.9.0-standalone.color-srgb-05.ui-20260821-05.html#atlas-dataviz-title",
      "relationship": "upstream_complete_reference"
    }
  },
  "capabilityBoundary": {
    "enabled": [
      "localFixtureState",
      "themePreference",
      "localePreference",
      "clipboardCopy"
    ],
    "disabled": [
      "analytics",
      "remotePersistence",
      "remoteAction",
      "networkShare",
      "cityScanScoring",
      "officerOperations"
    ],
    "fallbackRule": {
      "th": "ถ้าไม่มีต้นทางหรือ capability ที่อนุมัติ ให้แสดงคำว่าไม่มีข้อมูลหรือยังใช้ไม่ได้ ห้ามเดาสี",
      "en": "When an approved source or capability is absent, show unavailable or no-data copy; never guess a colour."
    }
  },
  "sourceFiles": [
    {
      "sourceId": "ldsTokens",
      "path": "../../../vendor/landometer/v0.9.0/tokens.json",
      "sha256": "5afa9a93bafa8f2e5edb7e929d4924bc548a415098377ad53e18097c56980287",
      "declaredSourceSha256": "00863492782b2fb1f93e6229f644fa0c092bde0e8c5d1093619c3120d73a71fc",
      "authority": "pinned LDS token package",
      "availability": "vendored"
    },
    {
      "sourceId": "ldsCss",
      "path": "../../../vendor/landometer/v0.9.0/build-kit/lds-tokens.css",
      "sha256": "aa834b08c6ecd00704a0c3580da83d291237738815a8e2e408aba12bb9551323",
      "authority": "pinned LDS CSS delivery",
      "availability": "vendored"
    },
    {
      "sourceId": "colorDelivery",
      "path": "../../../vendor/landometer/v0.9.0/color-delivery.json",
      "sha256": "aa6833b5286f6eb957925cb0c538c951d6822217fb83b051a71473ff2bdbd9c5",
      "authority": "pinned LDS gradient and foreground delivery",
      "availability": "vendored"
    },
    {
      "sourceId": "surfaceRecipes",
      "path": "../../../vendor/landometer/v0.9.0/surface-recipes.json",
      "sha256": "9e849896c0fa49411e226bfa7ca094d939e7e36cbd31e67cd0a76c44f0027d92",
      "authority": "pinned LDS reference-only recipe registry",
      "availability": "vendored"
    },
    {
      "sourceId": "identityManifest",
      "path": "../../../assets/identity/identity-assets.v0.6.1.json",
      "sha256": "56a5cc6f4fbecdcb150deea5fc91f81a795cab32d8b746eeb639fd3b8bce6bef",
      "authority": "CityChat exact-build identity approval",
      "availability": "local_approved"
    },
    {
      "sourceId": "approvedVes",
      "path": "../../../assets/downloads/citychat-visual-experience-specification-v0.6.md",
      "sha256": "5a137425ab195c4b5dd123ea86d0ee8730b370540eb57f05baf978fc6ca33a21",
      "authority": "CityChat approved normative VES",
      "availability": "local_approved"
    },
    {
      "sourceId": "ldsScales",
      "immutableUrl": "https://raw.githubusercontent.com/montri-th/Landometer/d82ac775ab9d35a84cfb0dc77bc0ae804a7a0665/assets/data/scales.json",
      "sha256": "daf8e5219f1da9229d7fb474fdaba3957f37c0cfe18eef7527e551c37d88d235",
      "authority": "pinned LDS analytical scale registry; linked, not vendored",
      "availability": "linked_not_vendored"
    }
  ],
  "router": [
    {
      "routerId": "cc-router-identity",
      "family": "identity",
      "label": {
        "th": "นี่คือ CityChat ไหม",
        "en": "Is it CityChat?"
      },
      "question": {
        "th": "กำลังบอกตัวตนหรือแค่ตกแต่ง",
        "en": "Is this identity or decoration?"
      }
    },
    {
      "routerId": "cc-router-reading",
      "family": "reading",
      "label": {
        "th": "อ่านง่ายไหม",
        "en": "Can people read it?"
      },
      "question": {
        "th": "กำลังจัดพื้น ข้อความ หรือเส้นขอบ",
        "en": "Is the job surface, text, or border?"
      }
    },
    {
      "routerId": "cc-router-action",
      "family": "action",
      "label": {
        "th": "กดต่อได้ไหม",
        "en": "Can people act?"
      },
      "question": {
        "th": "สิ่งที่กดได้ชัดโดยไม่แปลว่าสำเร็จหรือยัง",
        "en": "Is the action clear without implying success?"
      }
    },
    {
      "routerId": "cc-router-state-source",
      "family": "state-source",
      "label": {
        "th": "เกิดอะไรขึ้น",
        "en": "What happened?"
      },
      "question": {
        "th": "นี่คือสถานะหรือชนิดของที่มา",
        "en": "Is this a state or a source class?"
      }
    },
    {
      "routerId": "cc-router-atmosphere",
      "family": "atmosphere",
      "label": {
        "th": "ช่วงนี้ควรรู้สึกอย่างไร",
        "en": "What should this moment feel like?"
      },
      "question": {
        "th": "กำลังเริ่ม ทำความเข้าใจ ลงมือ หรือร่วมสร้าง",
        "en": "Is this entry, understanding, action, or co-creation?"
      }
    },
    {
      "routerId": "cc-router-map-data",
      "family": "map-data",
      "label": {
        "th": "นี่คือแผนที่หรือข้อมูลไหม",
        "en": "Is it map or data?"
      },
      "question": {
        "th": "มีสัญญาข้อมูลและคำอธิบายครบหรือยัง",
        "en": "Is the owning data contract complete?"
      }
    },
    {
      "routerId": "cc-router-assets",
      "family": "assets",
      "label": {
        "th": "มีไฟล์ที่อนุมัติไหม",
        "en": "Is the asset approved?"
      },
      "question": {
        "th": "มีไฟล์ สิทธิ์ แฮช และบทบาทครบหรือยัง",
        "en": "Do bytes, rights, hash, and role approval exist?"
      }
    }
  ],
  "roles": [
    {
      "roleId": "cc.identity.logo-band",
      "family": "identity",
      "status": "governed",
      "policy": "required",
      "artifactUse": "rendered",
      "label": {
        "th": "แถบโลโก้ CityChat",
        "en": "CityChat logo band"
      },
      "job": {
        "th": "ทำให้รู้ว่าอยู่ใน CityChat โดยไม่แตะสีในโลโก้",
        "en": "Identify CityChat without recolouring the approved lockup."
      },
      "useWhen": {
        "th": "ส่วนหัวและส่วนท้ายที่วางโลโก้จริง",
        "en": "Header and footer surfaces carrying the approved lockup."
      },
      "bindings": [
        {
          "slot": "surface",
          "implementation": "--brand-beige",
          "sourceByTheme": {
            "light": {
              "sourceId": "ldsTokens",
              "pointer": "/values/brand/beige"
            },
            "dark": {
              "sourceId": "ldsTokens",
              "pointer": "/values/brand/darkBeige"
            }
          }
        }
      ],
      "consumers": [
        "site_header",
        "site_footer"
      ],
      "redundantCue": [
        "approved CityChat horizontal lockup"
      ],
      "doNotUseFor": [
        "status",
        "data",
        "priority",
        "logo recolouring"
      ],
      "acceptanceIds": [
        "CC-AC-IDENTITY-01",
        "CC-AC-IDENTITY-02",
        "CC-AC-CONTRAST-01"
      ]
    },
    {
      "roleId": "cc.identity.product-field",
      "family": "identity",
      "status": "governed",
      "policy": "permitted",
      "artifactUse": "rendered",
      "label": {
        "th": "พื้นบรรยากาศ CityChat",
        "en": "CityChat product field"
      },
      "job": {
        "th": "ให้กลิ่นอาย CityChat ในพื้นที่เล่าเรื่องขนาดจำกัด",
        "en": "Carry CityChat atmosphere in a bounded story surface."
      },
      "useWhen": {
        "th": "ฮีโร่หรือช่วงเล่าเรื่องที่คำยังอ่านชัด",
        "en": "Hero or story moments with an exact foreground contract."
      },
      "bindings": [
        {
          "slot": "surface",
          "implementation": "--product-citychat-gradient",
          "sourceByTheme": {
            "light": {
              "sourceId": "colorDelivery",
              "pointer": "/productIdentityGradients/citychat/light"
            },
            "dark": {
              "sourceId": "colorDelivery",
              "pointer": "/productIdentityGradients/citychat/dark"
            }
          }
        },
        {
          "slot": "primary-ink",
          "implementation": "--cc-on-product-citychat",
          "sourceByTheme": {
            "light": {
              "sourceId": "colorDelivery",
              "pointer": "/surfaceForegroundContracts/surfaceForeground.onDeep/primary"
            },
            "dark": {
              "sourceId": "colorDelivery",
              "pointer": "/surfaceForegroundContracts/surfaceForeground.onLight/primary"
            }
          }
        },
        {
          "slot": "secondary-ink",
          "implementation": "--cc-on-product-citychat-2",
          "sourceByTheme": {
            "light": {
              "sourceId": "colorDelivery",
              "pointer": "/surfaceForegroundContracts/surfaceForeground.onDeep/secondary"
            },
            "dark": {
              "sourceId": "colorDelivery",
              "pointer": "/surfaceForegroundContracts/surfaceForeground.onLight/secondary"
            }
          }
        }
      ],
      "consumers": [
        "story_hero",